{"$schema":"https://json-schema.org/draft/2020-12/schema","title":"DecisionDomainTaxonomy","type":"object","additionalProperties":false,"required":["taxonomy_id","version","status","target_scope","primary_classification_values","classification_policy","domains","not_in_scope"],"properties":{"taxonomy_id":{"type":"string"},"version":{"type":"string"},"status":{"type":"string"},"target_scope":{"type":"object"},"primary_classification_values":{"type":"array","items":{"enum":["decision_family","evidence_domain","safety_gate","source_boundary_rule","capability_proof_rule","execution_risk_control","future_expansion","merge_candidate"]}},"classification_policy":{"type":"string"},"domains":{"type":"array","items":{"type":"object","required":["id","primary_classification","purpose","allowed_scope","owner_role","downstream_consumer"],"properties":{"id":{"type":"string"},"primary_classification":{"enum":["decision_family","evidence_domain","safety_gate","source_boundary_rule","capability_proof_rule","execution_risk_control","future_expansion","merge_candidate"]},"purpose":{"type":"string"},"allowed_scope":{"type":"array"},"owner_role":{"type":"string"},"downstream_consumer":{"type":"array"},"not_a_full_matrix":{"type":"boolean"}}}},"not_in_scope":{"type":"array"}}}
