{"taxonomy_id":"decision-domain-taxonomy.v0","version":"0.1.0","status":"foundation","target_scope":{"valid_target_options":["elementor_v4"],"forbidden_valid_target_options":["elementor_v3"],"elementor_v3_allowed_contexts":["legacy_risk","migration_boundary","unsupported_target","forbidden_fallback","compatibility_warning"],"rule_id":"R-DGOV-003"},"primary_classification_values":["decision_family","evidence_domain","safety_gate","source_boundary_rule","capability_proof_rule","execution_risk_control","future_expansion","merge_candidate"],"classification_policy":"Each domain has exactly one primary_classification.","domains":[{"id":"v4_element_identity","primary_classification":"decision_family","purpose":"Govern V4 element identity before execution.","allowed_scope":["elementor_v4_decision_record"],"owner_role":"Kernel","downstream_consumer":["Architect","CE","Builder"],"not_a_full_matrix":true},{"id":"layout_structure","primary_classification":"decision_family","purpose":"Govern Div/Flexbox/Grid structure choices.","allowed_scope":["elementor_v4_decision_record"],"owner_role":"Kernel","downstream_consumer":["Architect","CE","Builder"],"not_a_full_matrix":true},{"id":"media_choice","primary_classification":"decision_family","purpose":"Govern Image/SVG/media element choices.","allowed_scope":["elementor_v4_decision_record"],"owner_role":"Kernel","downstream_consumer":["Architect","CE","Builder"],"not_a_full_matrix":true},{"id":"text_semantics","primary_classification":"decision_family","purpose":"Govern Heading/Paragraph semantic choices.","allowed_scope":["elementor_v4_decision_record"],"owner_role":"Kernel","downstream_consumer":["Architect","CE","Builder"],"not_a_full_matrix":true},{"id":"interaction_link_topology","primary_classification":"decision_family","purpose":"Govern clickable/link topology.","allowed_scope":["elementor_v4_decision_record"],"owner_role":"Kernel","downstream_consumer":["Architect","CE","Builder"],"not_a_full_matrix":true},{"id":"positioning_safety","primary_classification":"decision_family","purpose":"Govern normal/relative/absolute positioning safety.","allowed_scope":["elementor_v4_decision_record"],"owner_role":"Kernel","downstream_consumer":["Architect","CE","Builder"],"not_a_full_matrix":true},{"id":"styling_mechanism","primary_classification":"decision_family","purpose":"Govern native control/class/variable/custom CSS choices.","allowed_scope":["elementor_v4_decision_record"],"owner_role":"Kernel","downstream_consumer":["Architect","CE","Builder"],"not_a_full_matrix":true},{"id":"class_scope","primary_classification":"decision_family","purpose":"Govern local/global class scope choices.","allowed_scope":["elementor_v4_decision_record"],"owner_role":"Kernel","downstream_consumer":["Architect","CE","Builder"],"not_a_full_matrix":true},{"id":"value_binding","primary_classification":"decision_family","purpose":"Govern literal/variable/dynamic binding choices.","allowed_scope":["elementor_v4_decision_record"],"owner_role":"Kernel","downstream_consumer":["Architect","CE","Builder"],"not_a_full_matrix":true},{"id":"unit_decision","primary_classification":"decision_family","purpose":"Govern px/rem/%/auto/variable unit choices.","allowed_scope":["elementor_v4_decision_record"],"owner_role":"Kernel","downstream_consumer":["Architect","CE","Builder"],"not_a_full_matrix":true},{"id":"version_and_release_gate","primary_classification":"safety_gate","purpose":"Gate version and release claims.","allowed_scope":["kernel_local_validation"],"owner_role":"Kernel","downstream_consumer":["Architect","CE","Builder"],"not_a_full_matrix":true},{"id":"official_dependency_boundary","primary_classification":"source_boundary_rule","purpose":"Bound official docs vs dependency availability.","allowed_scope":["kernel_local_validation"],"owner_role":"Kernel","downstream_consumer":["Architect","CE","Builder"],"not_a_full_matrix":true},{"id":"atomic_export_schema_boundary","primary_classification":"source_boundary_rule","purpose":"Bound atomic schema/export/runtime equivalence.","allowed_scope":["kernel_local_validation"],"owner_role":"Kernel","downstream_consumer":["Architect","CE","Builder"],"not_a_full_matrix":true},{"id":"capability_proof_boundary","primary_classification":"capability_proof_rule","purpose":"Gate capability proof before Builder-ready.","allowed_scope":["kernel_local_validation"],"owner_role":"Kernel","downstream_consumer":["Architect","CE","Builder"],"not_a_full_matrix":true},{"id":"forbidden_overclaim_boundary","primary_classification":"execution_risk_control","purpose":"Reject runtime, Builder, downstream, production overclaims.","allowed_scope":["kernel_local_validation"],"owner_role":"Kernel","downstream_consumer":["Architect","CE","Builder"],"not_a_full_matrix":true},{"id":"custom_css_environment_gate_when_custom_css_selected","primary_classification":"safety_gate","purpose":"Require Custom CSS environment boundary.","allowed_scope":["kernel_local_validation"],"owner_role":"Kernel","downstream_consumer":["Architect","CE","Builder"],"not_a_full_matrix":true},{"id":"v4_only_target_gate","primary_classification":"safety_gate","purpose":"Reject V3 as valid target option.","allowed_scope":["kernel_local_validation"],"owner_role":"Kernel","downstream_consumer":["Architect","CE","Builder"],"not_a_full_matrix":true},{"id":"official_documented_capability","primary_classification":"evidence_domain","purpose":"Official documented capability evidence domain.","allowed_scope":["claim_boundary"],"owner_role":"Kernel","downstream_consumer":["Architect","CE"],"not_a_full_matrix":true},{"id":"project_availability_evidence","primary_classification":"evidence_domain","purpose":"Target project availability evidence domain.","allowed_scope":["claim_boundary"],"owner_role":"Kernel","downstream_consumer":["CE","Project Gate"],"not_a_full_matrix":true},{"id":"editor_capture_evidence","primary_classification":"evidence_domain","purpose":"Editor capture evidence domain.","allowed_scope":["claim_boundary"],"owner_role":"Kernel","downstream_consumer":["CE"],"not_a_full_matrix":true},{"id":"frontend_runtime_evidence","primary_classification":"evidence_domain","purpose":"Frontend runtime evidence domain.","allowed_scope":["claim_boundary"],"owner_role":"Kernel","downstream_consumer":["Responsive"],"not_a_full_matrix":true},{"id":"computed_style_evidence","primary_classification":"evidence_domain","purpose":"Browser computed style evidence domain.","allowed_scope":["claim_boundary"],"owner_role":"Kernel","downstream_consumer":["Responsive"],"not_a_full_matrix":true},{"id":"decision_matrix_wave_2","primary_classification":"future_expansion","purpose":"Reserved future matrix layer.","allowed_scope":["future_prompt_only"],"owner_role":"Kernel","downstream_consumer":["Architect"],"not_a_full_matrix":true},{"id":"feature_registry_overlap_candidates","primary_classification":"merge_candidate","purpose":"Future merge candidate with feature registry work.","allowed_scope":["future_prompt_only"],"owner_role":"Kernel","downstream_consumer":["Kernel"],"not_a_full_matrix":true}],"not_in_scope":["full_elementor_feature_registry","full_control_level_registry","runtime_collector","downstream_ev4_integration","builder_execution_proof","production_readiness"]}
